{
  "schema_version": 1,
  "app_id": "jm_apparel_cx",
  "generated_at": "2026-08-07T08:44:00Z",
  "source_path": "inputs/晶铭服饰关键词.xlsx",
  "candidates": [
    {
      "candidate_id": "legacy_candidate_ea81421c578792bc",
      "text": "儿童芭蕾tutu裙",
      "normalized_text": "儿童芭蕾tutu裙",
      "original_bucket": "search.terms",
      "source_path": "inputs/晶铭服饰关键词.xlsx",
      "source_refs": [
        {
          "source_ref_id": "scenario_source_b17ecaa4c4a8ed09",
          "kind": "legacy_keyword",
          "ref_id": "legacy_candidate_ea81421c578792bc",
          "path": "inputs/晶铭服饰关键词.xlsx",
          "original_bucket": "search.terms",
          "text": "儿童芭蕾tutu裙",
          "derivation": "legacy"
        }
      ],
      "duplicate_of_candidate_id": null,
      "cross_bucket_with": [],
      "evidence_status": "unreviewed"
    },
    {
      "candidate_id": "legacy_candidate_964f1a15b660e166",
      "text": "儿童舞蹈演出服",
      "normalized_text": "儿童舞蹈演出服",
      "original_bucket": "search.terms",
      "source_path": "inputs/晶铭服饰关键词.xlsx",
      "source_refs": [
        {
          "source_ref_id": "scenario_source_2507ad3769dc3b6d",
          "kind": "legacy_keyword",
          "ref_id": "legacy_candidate_964f1a15b660e166",
          "path": "inputs/晶铭服饰关键词.xlsx",
          "original_bucket": "search.terms",
          "text": "儿童舞蹈演出服",
          "derivation": "legacy"
        }
      ],
      "duplicate_of_candidate_id": null,
      "cross_bucket_with": [],
      "evidence_status": "unreviewed"
    },
    {
      "candidate_id": "legacy_candidate_96628b52f06af3ab",
      "text": "少儿芭蕾舞练功服",
      "normalized_text": "少儿芭蕾舞练功服",
      "original_bucket": "search.terms",
      "source_path": "inputs/晶铭服饰关键词.xlsx",
      "source_refs": [
        {
          "source_ref_id": "scenario_source_9a217b624a4db0fd",
          "kind": "legacy_keyword",
          "ref_id": "legacy_candidate_96628b52f06af3ab",
          "path": "inputs/晶铭服饰关键词.xlsx",
          "original_bucket": "search.terms",
          "text": "少儿芭蕾舞练功服",
          "derivation": "legacy"
        }
      ],
      "duplicate_of_candidate_id": null,
      "cross_bucket_with": [],
      "evidence_status": "unreviewed"
    },
    {
      "candidate_id": "legacy_candidate_8ee409e952f536d2",
      "text": "儿童舞台表演服",
      "normalized_text": "儿童舞台表演服",
      "original_bucket": "search.terms",
      "source_path": "inputs/晶铭服饰关键词.xlsx",
      "source_refs": [
        {
          "source_ref_id": "scenario_source_3b3b1a14741300bf",
          "kind": "legacy_keyword",
          "ref_id": "legacy_candidate_8ee409e952f536d2",
          "path": "inputs/晶铭服饰关键词.xlsx",
          "original_bucket": "search.terms",
          "text": "儿童舞台表演服",
          "derivation": "legacy"
        }
      ],
      "duplicate_of_candidate_id": null,
      "cross_bucket_with": [],
      "evidence_status": "unreviewed"
    },
    {
      "candidate_id": "legacy_candidate_8a9d8cd785fa32b8",
      "text": "定制儿童舞蹈服",
      "normalized_text": "定制儿童舞蹈服",
      "original_bucket": "search.terms",
      "source_path": "inputs/晶铭服饰关键词.xlsx",
      "source_refs": [
        {
          "source_ref_id": "scenario_source_b514a1ccf35d3d9a",
          "kind": "legacy_keyword",
          "ref_id": "legacy_candidate_8a9d8cd785fa32b8",
          "path": "inputs/晶铭服饰关键词.xlsx",
          "original_bucket": "search.terms",
          "text": "定制儿童舞蹈服",
          "derivation": "legacy"
        }
      ],
      "duplicate_of_candidate_id": null,
      "cross_bucket_with": [],
      "evidence_status": "unreviewed"
    },
    {
      "candidate_id": "legacy_candidate_e40737b279cba4c2",
      "text": "菏泽儿童芭蕾tutu裙质量好",
      "normalized_text": "菏泽儿童芭蕾tutu裙质量好",
      "original_bucket": "qa.questions",
      "source_path": "inputs/晶铭服饰关键词.xlsx",
      "source_refs": [
        {
          "source_ref_id": "scenario_source_06a6f66646fe7604",
          "kind": "legacy_keyword",
          "ref_id": "legacy_candidate_e40737b279cba4c2",
          "path": "inputs/晶铭服饰关键词.xlsx",
          "original_bucket": "qa.questions",
          "text": "菏泽儿童芭蕾tutu裙质量好",
          "derivation": "legacy"
        }
      ],
      "duplicate_of_candidate_id": null,
      "cross_bucket_with": [],
      "evidence_status": "unreviewed"
    },
    {
      "candidate_id": "legacy_candidate_f34fa5cf7cac1712",
      "text": "菏泽儿童芭蕾tutu裙性价比高",
      "normalized_text": "菏泽儿童芭蕾tutu裙性价比高",
      "original_bucket": "qa.questions",
      "source_path": "inputs/晶铭服饰关键词.xlsx",
      "source_refs": [
        {
          "source_ref_id": "scenario_source_08a89d43a1cfe793",
          "kind": "legacy_keyword",
          "ref_id": "legacy_candidate_f34fa5cf7cac1712",
          "path": "inputs/晶铭服饰关键词.xlsx",
          "original_bucket": "qa.questions",
          "text": "菏泽儿童芭蕾tutu裙性价比高",
          "derivation": "legacy"
        }
      ],
      "duplicate_of_candidate_id": null,
      "cross_bucket_with": [],
      "evidence_status": "unreviewed"
    },
    {
      "candidate_id": "legacy_candidate_27f11bcd712fccce",
      "text": "儿童芭蕾tutu裙哪家工厂靠谱",
      "normalized_text": "儿童芭蕾tutu裙哪家工厂靠谱",
      "original_bucket": "intent.questions",
      "source_path": "inputs/晶铭服饰关键词.xlsx",
      "source_refs": [
        {
          "source_ref_id": "scenario_source_9a1885c87f72b5f6",
          "kind": "legacy_keyword",
          "ref_id": "legacy_candidate_27f11bcd712fccce",
          "path": "inputs/晶铭服饰关键词.xlsx",
          "original_bucket": "intent.questions",
          "text": "儿童芭蕾tutu裙哪家工厂靠谱",
          "derivation": "legacy"
        }
      ],
      "duplicate_of_candidate_id": null,
      "cross_bucket_with": [],
      "evidence_status": "unreviewed"
    },
    {
      "candidate_id": "legacy_candidate_410a1207c6d645de",
      "text": "儿童芭蕾tutu裙厂家哪家强",
      "normalized_text": "儿童芭蕾tutu裙厂家哪家强",
      "original_bucket": "intent.questions",
      "source_path": "inputs/晶铭服饰关键词.xlsx",
      "source_refs": [
        {
          "source_ref_id": "scenario_source_0b1a4137c62302c7",
          "kind": "legacy_keyword",
          "ref_id": "legacy_candidate_410a1207c6d645de",
          "path": "inputs/晶铭服饰关键词.xlsx",
          "original_bucket": "intent.questions",
          "text": "儿童芭蕾tutu裙厂家哪家强",
          "derivation": "legacy"
        }
      ],
      "duplicate_of_candidate_id": null,
      "cross_bucket_with": [],
      "evidence_status": "unreviewed"
    },
    {
      "candidate_id": "legacy_candidate_2e7cc4b33a45093f",
      "text": "儿童芭蕾tutu裙工厂哪家好",
      "normalized_text": "儿童芭蕾tutu裙工厂哪家好",
      "original_bucket": "intent.questions",
      "source_path": "inputs/晶铭服饰关键词.xlsx",
      "source_refs": [
        {
          "source_ref_id": "scenario_source_df300a36f8c9f3ba",
          "kind": "legacy_keyword",
          "ref_id": "legacy_candidate_2e7cc4b33a45093f",
          "path": "inputs/晶铭服饰关键词.xlsx",
          "original_bucket": "intent.questions",
          "text": "儿童芭蕾tutu裙工厂哪家好",
          "derivation": "legacy"
        }
      ],
      "duplicate_of_candidate_id": null,
      "cross_bucket_with": [],
      "evidence_status": "unreviewed"
    },
    {
      "candidate_id": "legacy_candidate_07ee3cbc51e05712",
      "text": "儿童芭蕾tutu裙支持定制厂家",
      "normalized_text": "儿童芭蕾tutu裙支持定制厂家",
      "original_bucket": "intent.questions",
      "source_path": "inputs/晶铭服饰关键词.xlsx",
      "source_refs": [
        {
          "source_ref_id": "scenario_source_d287862dd447de2b",
          "kind": "legacy_keyword",
          "ref_id": "legacy_candidate_07ee3cbc51e05712",
          "path": "inputs/晶铭服饰关键词.xlsx",
          "original_bucket": "intent.questions",
          "text": "儿童芭蕾tutu裙支持定制厂家",
          "derivation": "legacy"
        }
      ],
      "duplicate_of_candidate_id": null,
      "cross_bucket_with": [],
      "evidence_status": "unreviewed"
    },
    {
      "candidate_id": "legacy_candidate_5dbbfdbfc9b5ed2c",
      "text": "儿童芭蕾tutu裙工厂哪家质量好",
      "normalized_text": "儿童芭蕾tutu裙工厂哪家质量好",
      "original_bucket": "intent.questions",
      "source_path": "inputs/晶铭服饰关键词.xlsx",
      "source_refs": [
        {
          "source_ref_id": "scenario_source_2fb244f01b787576",
          "kind": "legacy_keyword",
          "ref_id": "legacy_candidate_5dbbfdbfc9b5ed2c",
          "path": "inputs/晶铭服饰关键词.xlsx",
          "original_bucket": "intent.questions",
          "text": "儿童芭蕾tutu裙工厂哪家质量好",
          "derivation": "legacy"
        }
      ],
      "duplicate_of_candidate_id": null,
      "cross_bucket_with": [],
      "evidence_status": "unreviewed"
    },
    {
      "candidate_id": "legacy_candidate_d5d7604096fb8db3",
      "text": "儿童芭蕾tutu裙性价比高厂家",
      "normalized_text": "儿童芭蕾tutu裙性价比高厂家",
      "original_bucket": "intent.questions",
      "source_path": "inputs/晶铭服饰关键词.xlsx",
      "source_refs": [
        {
          "source_ref_id": "scenario_source_c9f0538bd7f1d116",
          "kind": "legacy_keyword",
          "ref_id": "legacy_candidate_d5d7604096fb8db3",
          "path": "inputs/晶铭服饰关键词.xlsx",
          "original_bucket": "intent.questions",
          "text": "儿童芭蕾tutu裙性价比高厂家",
          "derivation": "legacy"
        }
      ],
      "duplicate_of_candidate_id": null,
      "cross_bucket_with": [],
      "evidence_status": "unreviewed"
    },
    {
      "candidate_id": "legacy_candidate_9985f8710642dceb",
      "text": "儿童芭蕾tutu裙哪家工厂值得信赖",
      "normalized_text": "儿童芭蕾tutu裙哪家工厂值得信赖",
      "original_bucket": "intent.questions",
      "source_path": "inputs/晶铭服饰关键词.xlsx",
      "source_refs": [
        {
          "source_ref_id": "scenario_source_1a693336f827d255",
          "kind": "legacy_keyword",
          "ref_id": "legacy_candidate_9985f8710642dceb",
          "path": "inputs/晶铭服饰关键词.xlsx",
          "original_bucket": "intent.questions",
          "text": "儿童芭蕾tutu裙哪家工厂值得信赖",
          "derivation": "legacy"
        }
      ],
      "duplicate_of_candidate_id": null,
      "cross_bucket_with": [],